{
  "$schema": "https://json-schema.org/draft/2020-12/schema",
  "title": "CrownAbility",
  "type": "object",
  "required": [
    "id",
    "name",
    "description",
    "namePlain",
    "descriptionPlain",
    "icon",
    "thumb",
    "cost",
    "dlc"
  ],
  "properties": {
    "id": {
      "type": "string",
      "pattern": "^[A-Za-z0-9_-]+$"
    },
    "name": {
      "type": "object",
      "additionalProperties": {
        "type": "string",
        "minLength": 1
      },
      "required": [
        "en"
      ]
    },
    "description": {
      "type": "object",
      "additionalProperties": {
        "type": "string",
        "minLength": 1
      }
    },
    "namePlain": {
      "type": "object",
      "additionalProperties": {
        "type": "string"
      },
      "description": "name without the game's text markup"
    },
    "descriptionPlain": {
      "type": "object",
      "additionalProperties": {
        "type": "string"
      },
      "description": "description without the game's text markup"
    },
    "icon": {
      "type": [
        "string",
        "null"
      ],
      "pattern": "^icons/crownAbilities/[A-Za-z0-9_-]+\\.png$"
    },
    "thumb": {
      "type": [
        "string",
        "null"
      ],
      "pattern": "^icons/crownAbilities/64/[A-Za-z0-9_-]+\\.png$"
    },
    "cost": {
      "type": "array",
      "items": {
        "type": "object",
        "required": [
          "item",
          "quantity"
        ],
        "properties": {
          "item": {
            "type": "string"
          },
          "quantity": {
            "type": "integer",
            "minimum": 0
          }
        }
      }
    },
    "dlc": {
      "type": "boolean",
      "description": ""
    }
  }
}
